{
  "schema_version": 1,
  "id": "operator",
  "name": "Operator",
  "description": "Operator automation tasks: ASSESS, SYNC, INIT",
  "version": "1.0.0",
  "publisher": "untra",
  "author": "Operator!",
  "url": "https://github.com/untra/operator",
  "license": "MIT",
  "tags": [
    "builtin",
    "automation"
  ],
  "issue_types": [
    {
      "key": "ASSESS",
      "schema_path": "ASSESS.json",
      "template_path": "ASSESS.md"
    },
    {
      "key": "SYNC",
      "schema_path": "SYNC.json",
      "template_path": "SYNC.md"
    },
    {
      "key": "INIT",
      "schema_path": "INIT.json",
      "template_path": "INIT.md"
    },
    {
      "key": "AGENT_SETUP",
      "schema_path": "AGENT_SETUP.json",
      "template_path": "AGENT_SETUP.md"
    },
    {
      "key": "PROJECT_INIT",
      "schema_path": "PROJECT_INIT.json",
      "template_path": "PROJECT_INIT.md"
    }
  ],
  "workflow_hints": {
    "loop_kind": "single_pass",
    "memory_surfaces": [
      "ticket",
      "catalog-info.yaml",
      ".claude/agents/"
    ],
    "review_gates": [
      "human"
    ],
    "external_tools": [
      "git"
    ],
    "stop_conditions": [
      "setup_artifacts_written"
    ],
    "runner_semantics": "prompt_driven"
  },
  "default_selected": [
    "ASSESS",
    "SYNC",
    "INIT"
  ]
}
